text	label_x	label_y	_merge
I received my Virtual card information, but was unable to use it to make a purchase. Why did this happen and what can I do?	virtual_card_not_working		left_only
what is the fee for a transfer into my account	top_up_by_bank_transfer_charge		left_only
I just replaced my phone so do I have to make a new account?	lost_or_stolen_phone		left_only
What is this €1 fee in my statement?	extra_charge_on_statement		left_only
What's the limit on automatic top-up?	automatic_top_up		left_only
I locked myself out of my account, how do I unblock my PIN?	pin_blocked		left_only
Why has my card been charged an extra pound?	extra_charge_on_statement		left_only
I am unhappy with my purchase, how do I cancel the order?	request_refund		left_only
What is the process for transferring money into my account?	transfer_into_account		left_only
I was overcharged one extra pound!	extra_charge_on_statement		left_only
My actual card isn't functioning.	card_not_working		left_only
I don't know what's wrong with my card, but it has not worked at multiple places today.	card_not_working		left_only
Where can I withdraw money from?	atm_support		left_only
I would like to cancel a transfer	cancel_transfer		left_only
Why isn't my top up working using my saved American Express in ApplePay?	apple_pay_or_google_pay		left_only
I would like to revert a transaction I did this morning	cancel_transfer		left_only
Hi,  My money has not been credited to my account for which i have sent you cheque few days before. I am worried about the money please let me know the status.	balance_not_updated_after_cheque_or_cash_deposit		left_only
I've been charged an extra £1 and I don't know what it's for	extra_charge_on_statement		left_only
I need help proving that this is really me and to verify my identity.	unable_to_verify_identity		left_only
Transferring money using credit card	topping_up_by_card		left_only
If I transfer money from my bank to top-up my account will I be charged?	top_up_by_bank_transfer_charge		left_only
I need more than one disposable card	disposable_card_limits		left_only
Do I get charged if i am getting money?	top_up_by_bank_transfer_charge		left_only
I need to cancel a transfer	cancel_transfer		left_only
I did not receive the right amount of cash I requested	wrong_amount_of_cash_received		left_only
In regards to my card payment, the exchange rate is incorrect.	card_payment_wrong_exchange_rate		left_only
Where do I go to change my account details?	edit_personal_details		left_only
Why isn't my refund on my statement?	Refund_not_showing_up		left_only
Do you know the closest ATM?	atm_support		left_only
Is there an age limit for opening an account?	age_limit		left_only
What fiat currencies can I use for holding and exchanging?	fiat_currency_support		left_only
I'd prefer a Mastercard.	visa_or_mastercard		left_only
What steps do I do to transfer money using my credit card?	topping_up_by_card		left_only
I have just read my statement and there is a payment I don't recognise.	card_payment_not_recognised		left_only
How do I check security settings on my card?	card_not_working		left_only
How does my identity get verified?	verify_my_identity		left_only
I did not make a direct debit payment as listed on my app	direct_debit_payment_not_recognised		left_only
I need to change my PIN. Can I do that at a cash machine?	change_pin		left_only
Your exchange rate is totally wrong for my card payment	card_payment_wrong_exchange_rate		left_only
I just saw the exchange rate you use, but it's so bad that I can't believe that it's the official interbank exchange rate! Is this truly the official interbank exchange rate?	card_payment_wrong_exchange_rate		left_only
My card is needed soon	card_delivery_estimate		left_only
Can you tell me what is wrong ? I top-up with you all the time but this time it just shows my top-up as pending. What is happening?	pending_top_up		left_only
Please inform me how to get a new card as mine is about to expire.	card_about_to_expire		left_only
Why is it I am charged an extra fee when I use the ATM?	cash_withdrawal_charge		left_only
Yikes!  I didn't get the amount of money that I requested.  What do I do now?	wrong_amount_of_cash_received		left_only
Are there ways to transfer money into my account?	transfer_into_account		left_only
I didn't get cash from an ATM, but the app says I did	cash_withdrawal_not_recognised		left_only
I'd like to have another card	getting_spare_card		left_only
Exchange rate for my card payment is wrong	card_payment_wrong_exchange_rate		left_only
I desperately need to transfer something from China, Please give me the wait time.	transfer_timing		left_only
I received an extra charge for using the card. Why?	card_payment_fee_charged		left_only
I want to order another crad	getting_spare_card		left_only
are both visa and mastercard available to me?	visa_or_mastercard		left_only
How do you check my identity?	verify_my_identity		left_only
What do I have to do to get a Visa card?	visa_or_mastercard		left_only
It says that my payment is pending, what does that mean?	pending_card_payment		left_only
Some cash withdrawal that I didn't make showed up in the app.	cash_withdrawal_not_recognised		left_only
How do I get my disposable virtual card to work?	virtual_card_not_working		left_only
What countries do you support?	country_support		left_only
Why am I charged a fee for using my card on some purchases?	card_payment_fee_charged		left_only
Please, tell me why I can't have the funds I deposited a week ago? I need the money now.	balance_not_updated_after_cheque_or_cash_deposit		left_only
I'd like to transfer funds using my credit card.	topping_up_by_card		left_only
What can I expect if I use bank transfer to top up my account?	transfer_into_account		left_only
I tried to take out cash but the amount isn't right, so what do I do?	wrong_amount_of_cash_received		left_only
I'm pretty sure my top up is still pending.	pending_top_up		left_only
I'm having issues with my card. You guys keep declining it for some reason. I haven't had any issues up until this point. What is going on? I've tried a handful of times with the same, unfortunate, result!	declined_transfer		left_only
When trying to get more than one card is there a extra amount that needs to be paid?	getting_spare_card		left_only
What are the places that you deliver cards to?	order_physical_card		left_only
How do people send me money?	receiving_money		left_only
Can cards be dispatched on a specific date?	card_delivery_estimate		left_only
Where do I order my card?	order_physical_card		left_only
Any extra charges for exchanging currencies?	exchange_charge		left_only
I have never been charged for making an ATM cash withdrawal before, but I am now being charged a fee to withdraw cash. What happened?	cash_withdrawal_charge		left_only
I made a mistake when I did a transfer so now what can I do to fix that?	cancel_transfer		left_only
It's requiring me to verify my identity?	why_verify_identity		left_only
A transfer is pending.	pending_transfer		left_only
Is there a limit to how much I can top-up?	top_up_limits		left_only
What sort of restrictions are there for the disposable cards?	disposable_card_limits		left_only
Is this where I order a virtual card?	getting_virtual_card		left_only
How can my friend send me money?	receiving_money		left_only
My PIN can't access my card, can you help?.	pin_blocked		left_only
Can I call to get my card activated?	activate_my_card		left_only
My cash received does not match what has been requested	wrong_amount_of_cash_received		left_only
Please help me!  A payment I made had an error on the account number and I can't cancel on my side.  Can you cancel it?	cancel_transfer		left_only
Why haven't I received a refund yet?	Refund_not_showing_up		left_only
Where can I get a second card?	getting_spare_card		left_only
Cannot access my top up.	topping_up_by_card		left_only
I need my card now!	card_delivery_estimate		left_only
Tell me what I need to do to activate my card.	activate_my_card		left_only
The exchange rate given to me wasn't correct, after i purchased an item	card_payment_wrong_exchange_rate		left_only
I want to transfer money to a beneficiary, but I couldn't.	beneficiary_not_allowed		left_only
I have a cash withdrawal that I do not recognise.	cash_withdrawal_not_recognised		left_only
When do I get my PIN?	get_physical_card		left_only
I think the top up failed	top_up_failed		left_only
Would I be able to open an account for my daughter?	age_limit		left_only
I need to update my personal details	edit_personal_details		left_only
How can I go about transferring money to my account?	transfer_into_account		left_only
When will I be able to see my refund?	Refund_not_showing_up		left_only
When I deposit cheques and cash, my balance does not update.	balance_not_updated_after_cheque_or_cash_deposit		left_only
If I need a PIN for my card, where is it located?	get_physical_card		left_only
How long will it take for my ID to verify?	unable_to_verify_identity		left_only
I see a $1 charge in a transaction.	extra_charge_on_statement		left_only
I already paid to top-up but the funds aren't available yet, where are they?	pending_top_up		left_only
I submitted a cash deposit to my account but it hasn't posted yet.	balance_not_updated_after_cheque_or_cash_deposit		left_only
How long do you expect me to wait for the transfer? It finally worked out, but has been pending for a long time and it's quite urgent.	pending_transfer		left_only
What do you need for my identity check?	verify_my_identity		left_only
Hello. How do i go about getting a refund of an item i bought ? I want to cancel the payment since i have not received the item yet.	request_refund		left_only
Why do I get a fee every time I transfer?	transfer_fee_charged		left_only
If I were to transfer, what would the cost be?	top_up_by_bank_transfer_charge		left_only
I have questions about how to transfer money to my account.	transfer_into_account		left_only
I need to change my address in the personal details.	edit_personal_details		left_only
The app says I made a cash withdrawal that I didn't make	cash_withdrawal_not_recognised		left_only
On my statement, there is a strange 1£ charge that appears as pending. What's causing that? I haven't purchased anything that's just a pound.	extra_charge_on_statement		left_only
How much does it cost to get a new card?  Mine is almost expired.  How fast does it come?	card_about_to_expire		left_only
Am I supposed to verify my identity?	why_verify_identity		left_only
Is my PIN located on my account somewhere?	get_physical_card		left_only
How many times can I make a top-up?	top_up_limits		left_only
Is it possible for me to get a virtual card?	getting_virtual_card		left_only
The ATM is declining my card. I tried at two different ATMs. Can you tell me if there's anything wrong with my account?	declined_cash_withdrawal		left_only
Money was taken out without my consent,	cash_withdrawal_not_recognised		left_only
Help me.  There is a Direct Debit that I didn't make.	direct_debit_payment_not_recognised		left_only
Why would my card payment be reverted?	reverted_card_payment?		left_only
What businesses can I use this card with?	card_acceptance		left_only
Please assist me with activation.	activate_my_card		left_only
I just received my card and I'd like to activate it.	activate_my_card		left_only
I lost my phone and need help so someone doesn't access my account.	lost_or_stolen_phone		left_only
I'm not sure where my phone is, I think someone stole it or it's lost.	lost_or_stolen_phone		left_only
Can I cancel my transaction?	cancel_transfer		left_only
Hi, My card withdrawal was declined this morning. It was working fine till yesterday. Please check and inform me.	declined_cash_withdrawal		left_only
How many transactions can I do with my disposable card?	disposable_card_limits		left_only
Where is my virtual card?	getting_virtual_card		left_only
Can I use my card while on vacation overseas?	card_acceptance		left_only
How do I deal with a stolen card?	lost_or_stolen_card		left_only
Do I pay a fee for SEPA transfers?	top_up_by_bank_transfer_charge		left_only
Is there a list of ATMs that take this card?	atm_support		left_only
Would I need to pay extra for currency exchanges?	exchange_charge		left_only
How would I change my details?	edit_personal_details		left_only
what is this charge i didnt do it what can i do	direct_debit_payment_not_recognised		left_only
A strange card payment, I do not recognize it.	card_payment_not_recognised		left_only
I sent a transfer and it has been pending for awhile. How long will it stay pending?	pending_transfer		left_only
I made a mistake and need to cancel a transaction	cancel_transfer		left_only
I need my card topped up,	topping_up_by_card		left_only
What does it mean if my payment has been reverted?	reverted_card_payment?		left_only
what is the average wait for transfers	transfer_timing		left_only
How does someone else top up my account	topping_up_by_card		left_only
Would I be charged for exchanging currencies?	exchange_charge		left_only
Do you accept SWIFT transfers?	top_up_by_bank_transfer_charge		left_only
Is auto top up a provided service?	automatic_top_up		left_only
I put money in my account a week ago but its still not there, what is happening?	balance_not_updated_after_cheque_or_cash_deposit		left_only
How can I create many temporary cards daily?	disposable_card_limits		left_only
Contactless isn't working for me	contactless_not_working		left_only
Is there an allowance on cards?	card_payment_fee_charged		left_only
Why hasn't my top-up been completed?	pending_top_up		left_only
Can you tell me where I can order a virtual card?	getting_virtual_card		left_only
I tried pulling out money at the ATM and it gave me an incorrect amount back.	wrong_amount_of_cash_received		left_only
I made a purchase but the exchange rate is wrong?	card_payment_wrong_exchange_rate		left_only
What do I need to do to get cash back? The ATM gave me the wrong amount that I requested but the app is showing the amount to be correct.	wrong_amount_of_cash_received		left_only
What do the disposable cards do?	get_disposable_virtual_card		left_only
virtual card won't work for me	virtual_card_not_working		left_only
Can apple pay handle top up exchanges?	apple_pay_or_google_pay		left_only
I cannot make a transfer to another account.	beneficiary_not_allowed		left_only
Why did I get less money than I asked for?	wrong_amount_of_cash_received		left_only
Why do you need so much information about my identity?	why_verify_identity		left_only
How many days does a transfer from the US take?	transfer_timing		left_only
Why is my disposable card not working?	virtual_card_not_working		left_only
A mortgage payment I'm making is giving me an error message.  This is the first time I'm making this payment and want to know what's wrong.	failed_transfer		left_only
Why is verification for my identity needed?	why_verify_identity		left_only
I can't do any business with this virtual card.	virtual_card_not_working		left_only
Why was I not able to get cash from the ATM?	declined_cash_withdrawal		left_only
Is there a transaction limit on a disposable card?	disposable_card_limits		left_only
can i deposit a check here?	top_up_by_cash_or_cheque		left_only
What is the need to verify my identity?	why_verify_identity		left_only
Is a non-electronic card available as well	order_physical_card		left_only
I want to top up by card	topping_up_by_card		left_only
What is the minimum age limit?	age_limit		left_only
Why doesn't a return show up im my account from a purchase I made?	Refund_not_showing_up		left_only
is apple pay costly?	apple_pay_or_google_pay		left_only
What am I going to need in order to activate my card?	activate_my_card		left_only
You can use it anywhere that accepts Mastercard.	card_acceptance		left_only
Do you use Mastercard or Visa?	visa_or_mastercard		left_only
My Netflix subscription says that there is an issue with my card information, but I thought everything was fine. Why would it be declined?	card_not_working		left_only
Tell my why my top-up is pending.	pending_top_up		left_only
Somehow I am missing my card.  What should I do?	lost_or_stolen_card		left_only
Hi! A seller that I requested a refund from a long time ago has yet to send the money into my account, even though I keep checking it. Can the seller be contacted by you guys to see what's going on?	Refund_not_showing_up		left_only
How long does a transfer transaction take?	transfer_timing		left_only
Do I have to go into the bank to change my PIN?	change_pin		left_only
I think my top-up has failed.	top_up_failed		left_only
Is there any way to cancel a transfer?	cancel_transfer		left_only
What is the fee on my statement for?	extra_charge_on_statement		left_only
Can I get a card even if I live outside the UK?	country_support		left_only
I needed to send my friends some money urgently.  I tried multiple times to transfer the money this morning, but the transfer keeps failing.  Can you tell me why the transfer is getting rejected?	failed_transfer		left_only
How long does it take for a transfer to be in my account?	transfer_timing		left_only
going to need a new card what are the fees and time it takes	card_about_to_expire		left_only
Talk me through modifying my details.	edit_personal_details		left_only
I've never been to that store.  That's a fraudulent charge.	card_payment_not_recognised		left_only
Send me a physical card	order_physical_card		left_only
My order needs to be canceled.	request_refund		left_only
The cash I asked for still hasn't been received	wrong_amount_of_cash_received		left_only
I want to revert this mornings transaction.	cancel_transfer		left_only
Why has my top-up failed?	top_up_failed		left_only
How do I get my card back after the ATM swallowed it.	card_swallowed		left_only
I am yet to receive my pin.	get_physical_card		left_only
How do I unblock my pin after entering it wrong too many times?	pin_blocked		left_only
I did not get the right amount of cash from the ATM.	wrong_amount_of_cash_received		left_only
What is the amount of disposable cards I can have each day?	disposable_card_limits		left_only
I believe my card has been compromised as there are funds showing that I did not receive.	cash_withdrawal_not_recognised		left_only
Why was I charged extra when paying with card?	card_payment_fee_charged		left_only
When can I expect my card to be delivered to the US?	card_delivery_estimate		left_only
I have a fee and I don't know why	card_payment_fee_charged		left_only
Why do I have two charges It should only be one charge?	transaction_charged_twice		left_only
I'm still waiting for the top-up!	pending_top_up		left_only
Can I use visa or mastercard with your service	visa_or_mastercard		left_only
Has my top up gone through?	pending_top_up		left_only
I didn't enjoy my tutor session and want a refund back. How do I go about doing this?	request_refund		left_only
How long does EU transfer take? I bought something online a couple days ago , sent the money immediately online but the seller says it is still not there yet	pending_transfer		left_only
Why isn't my refund showing up?	Refund_not_showing_up		left_only
Why is this payment pending?	pending_card_payment		left_only
Is there an alternative to a physical card?	getting_virtual_card		left_only
Where do I find my code to verify my top-up card?	verify_top_up		left_only
I can't see my refund on my account	Refund_not_showing_up		left_only
I have foreign currency i would like to change how much will it cost me?	exchange_charge		left_only
There is more than one of the same transaction on my account.	transaction_charged_twice		left_only
When can I use money sent to my account?	transfer_timing		left_only
I need more physical cards than I have right now!	getting_spare_card		left_only
How can I get cash back? The ATM just gave me the wrong amount that I've been actually charged though...	wrong_amount_of_cash_received		left_only
I returned something to a  store but can't see my refund.	Refund_not_showing_up		left_only
Google Pay isn't working. What is wrong?	apple_pay_or_google_pay		left_only
Is there a charge for getting more cards?	getting_spare_card		left_only
I'm really concerned because I only made one transaction, but it's appearing multiple times.	transaction_charged_twice		left_only
If I make a transaction can I cancel it?	cancel_transfer		left_only
How do I get my salary through this account?	receiving_money		left_only
How long does it take transfers from Europe to complete?	transfer_timing		left_only
I might need a new card because it's not working at any of the ATMs. I don't think ive used all my money. Why is it doing this?	declined_cash_withdrawal		left_only
I deposited cash into my account and I'm having trouble seeing it on my account.	balance_not_updated_after_cheque_or_cash_deposit		left_only
cash deposit to my account has shown a red flag.	balance_not_updated_after_cheque_or_cash_deposit		left_only
what is the disposable cards limit?	disposable_card_limits		left_only
Fix your system. I can't make transfers, I've tried like 5 times already.	failed_transfer		left_only
How can I order a card?	order_physical_card		left_only
I need help making this transfer. I keep getting an error. I'm trying to purchase a flat but i need my mortgage payment to go through first. Can you help?	failed_transfer		left_only
I made a mistake when sending a payment, sending it to the wrong account number (with a typo) - can you please cancel the transaction?	cancel_transfer		left_only
I thought I left my card at a restaurant, but they claim not to have it and now I don't have any idea where it is. I'm so worried that someone might be using it fraudulently. Is there any way to look into this?	lost_or_stolen_card		left_only
What is the maximum number of transactions that I can put on a disposable card?	disposable_card_limits		left_only
How do I go about setting up an account for my daughter?	age_limit		left_only
After I deposited my cash, I still don't see it in my account.	balance_not_updated_after_cheque_or_cash_deposit		left_only
Why do I have a transaction showing multiple times?	transaction_charged_twice		left_only
My entire gym bag, including my wallet, was stolen out of my locker today. Everything in my wallet is gone - how do I block the card to make it can't be used?	lost_or_stolen_card		left_only
I'm currently not in possession of my phone, is it still possible to go about things normally without access to the app?	lost_or_stolen_phone		left_only
Ive been trying to use my card for two weeks now to purchase somethings online but nothing is going through. It keeps returning my payment to my account. There shouldn't be anything wrong with my account, is it the card?	reverted_card_payment?		left_only
I requested a virtual card but it is not showing up. Why?	getting_virtual_card		left_only
In regards to the PIN of the card?	get_physical_card		left_only
I did a cash deposit to my account but it doesn't show up	balance_not_updated_after_cheque_or_cash_deposit		left_only
What does a 'pending payment' mean?	pending_card_payment		left_only
I am not receiving the correct exchange rate on my card.	card_payment_wrong_exchange_rate		left_only
I topped up but the app denied it	top_up_failed		left_only
I was wondering if I could get a second card on this account? I would like my daughter to have one.	getting_spare_card		left_only
Help me. My transfer was declined. How could this happen?	declined_transfer		left_only
Why is my physical card not working?	card_not_working		left_only
Can I use my card for payment all over the world?	card_acceptance		left_only
Why does it say my transfer failed?	failed_transfer		left_only
Not living in same place, need to change details	edit_personal_details		left_only
Is there a reason that the ATM declined my transaction?	declined_cash_withdrawal		left_only
Can I use a Visa or Mastercard?	visa_or_mastercard		left_only
My account isn't showing the refund	Refund_not_showing_up		left_only
This is not right, I was told I could take out cash at the ATM for free?	cash_withdrawal_charge		left_only
Why did I not get the amount I specified at the ATM?	wrong_amount_of_cash_received		left_only
I accidentally put in the wrong pin too many times and now I need to unblock it. Can you assist with this?	pin_blocked		left_only
What do I do if my phone is stolen?	lost_or_stolen_phone		left_only
Can another family member hold a card for this account in addition to mine?	getting_spare_card		left_only
My American express is experiencing a problem with apple play with top up, can you fix it?	apple_pay_or_google_pay		left_only
I am still waiting for verification.  Can I use my account before I am verified?	why_verify_identity		left_only
I can't find how to top up my account with a check.  Where is that?	top_up_by_cash_or_cheque		left_only
I paid with my card and I was charged a fee	card_payment_fee_charged		left_only
how long should i expect to wait when i add money	pending_top_up		left_only
The rate of exchange for my card payment is incorrect	card_payment_wrong_exchange_rate		left_only
How long does it take for a money transfer to show?	pending_transfer		left_only
I might have been charged on my debit statement by fraud.	direct_debit_payment_not_recognised		left_only
Do you have any options to top up with a cheque on my account?	top_up_by_cash_or_cheque		left_only
My card is expiring so how fast can I get a new one and how much will it be?	card_about_to_expire		left_only
Do you accept checks?	top_up_by_cash_or_cheque		left_only
My Virtual card was rejected for a car rental. Why?	virtual_card_not_working		left_only
I think the atm ate my card.	card_swallowed		left_only
When will my transfer from the US get here?	transfer_timing		left_only
limits on top ups	top_up_limits		left_only
Will you tell me how I am supposed to use the disposable cards?	get_disposable_virtual_card		left_only
What is my card's PIN?	get_physical_card		left_only
