text	label_x	label_y	_merge
How do I make my virtual card work?	virtual_card_not_working		left_only
HOW LONG THE CARD VALIDITY	card_not_working		left_only
Help, your app is showing a larger WD than I actually did earlier at an ATM.	wrong_amount_of_cash_received		left_only
Help!  I fear that my card was stolen,	lost_or_stolen_card		left_only
According to the app, I got cash from an ATM but I haven't made any transactions.	cash_withdrawal_not_recognised		left_only
How can my friend pay me?	receiving_money		left_only
I need to cancel a transaction please!	cancel_transfer		left_only
I am trying to complete a transfer but I keep getting an error message.	beneficiary_not_allowed		left_only
Why will my transfer not go through?!  Keep getting an error message.	beneficiary_not_allowed		left_only
I have a strange transaction for £1 on my statement, what is that?	extra_charge_on_statement		left_only
What is the exchange fee?	exchange_charge		left_only
i think someone is using my card to withdraw money. Someone stole my wallet. What can I do? it is urgent.	cash_withdrawal_not_recognised		left_only
why would a merchant refuse a payment	reverted_card_payment?		left_only
I have been double charged	transaction_charged_twice		left_only
I have been charged twice for the same transaction.	transaction_charged_twice		left_only
Where is the money I put in the bank?	balance_not_updated_after_cheque_or_cash_deposit		left_only
Can you help me activate my card	activate_my_card		left_only
Is there a strict timeline regarding disputing transactions made on my account? I just noticed a fraudulent charge on a statement from a couple months ago.	direct_debit_payment_not_recognised		left_only
I have no idea why there is a dollar that has been charged to my account.	extra_charge_on_statement		left_only
I live in the US, how long will it take for delivery?	card_delivery_estimate		left_only
Why am I being charged a hidden fee?	card_payment_fee_charged		left_only
I am still waiting for a money transfer to show	pending_transfer		left_only
Can I change my pin at an atm?	change_pin		left_only
Will you be adding more currencies in the future?	fiat_currency_support		left_only
If I can, I would like to get both Mastercard and Visa from you.	visa_or_mastercard		left_only
For the identity verification, what do you need?	verify_my_identity		left_only
It won't let me activate my card.	activate_my_card		left_only
I was charged a transfer fee, why is that?	transfer_fee_charged		left_only
My money I had was gone and I could not get gas!	topping_up_by_card		left_only
Can you help me to quickly cancel a transaction I accidentally did to the wrong account?	cancel_transfer		left_only
Hello. Can you tell me if you use Visa or Mastercard?	visa_or_mastercard		left_only
Hello, i'd like to inform you of an issue i'm currently experiencing. The goods i have ordered from your website have still not arrived yet; it has been over 3 weeks. I would like to be issued a refund swiftly and be redirected to more competent people. Thank you for your assistance.	request_refund		left_only
I want to top my account by using a bank transfer. How would that work?	transfer_into_account		left_only
I want to get a refund.	request_refund		left_only
How do I go forth with bank transfers for top up accounts?	transfer_into_account		left_only
What is the fastest that I can make a transfer?	transfer_timing		left_only
I transferred money from the US, How long does it take?	transfer_timing		left_only
Where in the European Union can I get a card?	country_support		left_only
I'm confused as to why my top-up did not go through.	top_up_failed		left_only
Does my top up and apple pay work together?	apple_pay_or_google_pay		left_only
Hi, I would like to file a claim for an inquiry. I am a frequent customer of the company in question and have never had any issue with my purchases, payments, or otherwise. However, the price deducted for an item I purchased a couple of weeks ago has been returned to my checking account. Was there an issue with my payment? The item has already been delivered to me.	reverted_card_payment?		left_only
my phone was lost	lost_or_stolen_phone		left_only
A transfer to my account was denied.	beneficiary_not_allowed		left_only
Can I also transfer with SWIFT?	top_up_by_bank_transfer_charge		left_only
I bought something and received it, but the payment went back to my account. Is the seller okay?	reverted_card_payment?		left_only
How can i get a refund for something i just bought?	request_refund		left_only
What does the bank charge for lost or stolen card replacements?	order_physical_card		left_only
Why do transfers get declined?	declined_transfer		left_only
How old do we have to be?	age_limit		left_only
I use my card internationally to manage payments and I just noticed that you are adding additional fees.  Why?  I am a good customer and this has me thinking about leaving.	transfer_fee_charged		left_only
I sent out money, but was charged extra for transferring. Why?	transfer_fee_charged		left_only
I was charged multiple times for one transaction.	transaction_charged_twice		left_only
I did not ask for the amount of cash that I received.	wrong_amount_of_cash_received		left_only
I don't have a virtual card - how do I get one?	getting_virtual_card		left_only
"Can you help me with a weird charge?  It's a pound charge that never goes away from the statement view on the app I'm using.  It's not described as anything but ""Pending"", and that status has never changed during the last two days."	extra_charge_on_statement		left_only
Please give me both Visa and MasterCard, is it possible?	visa_or_mastercard		left_only
I saw on the app that a cash withdrawal was completed on my account; however, I did not complete it.	cash_withdrawal_not_recognised		left_only
Are there any places that won't take my card?	card_acceptance		left_only
Why was I charged this extra fee while doing a transfer?	transfer_fee_charged		left_only
My identity verification didn't work	unable_to_verify_identity		left_only
I've completely forgot the code to get into the app.	passcode_forgotten		left_only
Where do i go to receive a virtual card	getting_virtual_card		left_only
How old do you need to be to open an account?	age_limit		left_only
How do I auto top-up?	automatic_top_up		left_only
I made a mistake and need to cancel a transfer.	cancel_transfer		left_only
Do you have support for flat currencies?	fiat_currency_support		left_only
I have a card payment which shows as pending	pending_card_payment		left_only
For the identity check, do I need any kind of documentation?	verify_my_identity		left_only
How long to I have to wait for a transfer to reach my account?	transfer_timing		left_only
I am missing a refund amount on my account.	Refund_not_showing_up		left_only
How can correct Top up with the app to work correctly?	top_up_failed		left_only
How do i receive a physical card?	order_physical_card		left_only
I was declined when I tried to get cash.	declined_cash_withdrawal		left_only
When using my card I was charged a fee for doing so, why?	card_payment_fee_charged		left_only
How long until transfers from Europe go through?	transfer_timing		left_only
The app doesn't know it's me.	unable_to_verify_identity		left_only
I am not able to use the app since I forgot my phone at the hotel I was staying at.	lost_or_stolen_phone		left_only
Why isn't my top up showing on my wallet?	topping_up_by_card		left_only
I don't know where this transaction came from?	card_payment_not_recognised		left_only
I need my PIN unlocked.	pin_blocked		left_only
What do I need to do to transfer money with my credit card?	topping_up_by_card		left_only
Can I change my PIN abroad?	change_pin		left_only
So, I see a strange fee that I've never seen before after making an online purchase from abroad. I was under the impression transfers could be made for free. I don't think this seems fair.	transfer_fee_charged		left_only
what can I do if I got my American Express in Apple Bay but top up is not working?	apple_pay_or_google_pay		left_only
I didn't get as much cash as I asked for from the ATM, why?	wrong_amount_of_cash_received		left_only
What should I do if I see an unauthorized withdrawal on my statement?	cash_withdrawal_not_recognised		left_only
My statement has not shown my refund.	Refund_not_showing_up		left_only
How do I go about getting an actual card?	order_physical_card		left_only
My exchange seems to have something wrong with it. I changed over Russian Ruble to UK pounds and it appears I was charged way more than I was supposed to be.	card_payment_wrong_exchange_rate		left_only
Why is there an identify check?	why_verify_identity		left_only
Can someone assist me with the details explaining which fiat currencies that you support?	fiat_currency_support		left_only
Transaction refund missing from my statement.	Refund_not_showing_up		left_only
Am I charged for receiving money?	top_up_by_bank_transfer_charge		left_only
If there isn't a lot of money left, will it automatically top-up money?	automatic_top_up		left_only
What ATM accepts Mastercard?	atm_support		left_only
Can I use my card anywere?	card_acceptance		left_only
how long does it take to reflect in my balance a top up	pending_top_up		left_only
If I need more cards, are there any fees?	getting_spare_card		left_only
When will my card payment be done pending?	pending_card_payment		left_only
I have a pending payment on my card.  Why?	pending_card_payment		left_only
I heard you have virtual cards. How do I get one?	getting_virtual_card		left_only
How do I verify the top-up card?	verify_top_up		left_only
There was a charge applied when I used my card.	card_payment_fee_charged		left_only
What is the verification process for my card?	verify_top_up		left_only
Why are there limits on auto top-up?	automatic_top_up		left_only
I haven't received my transfer funds yet, where are they?	pending_transfer		left_only
What apps can I use to top up my account?	top_up_by_cash_or_cheque		left_only
Why can't I use this beneficiary?	beneficiary_not_allowed		left_only
I am getting continuous failure for all my transfers. I have cross checked each recipient detail again and again and everything is correct.	declined_transfer		left_only
Can friends add to my account	topping_up_by_card		left_only
My disposable virtual card isn't working.	virtual_card_not_working		left_only
I can't find my card!  What should I do?	lost_or_stolen_card		left_only
My card got stolen!	lost_or_stolen_card		left_only
Are there any discounts in exchanging currencies frequently?	exchange_charge		left_only
My phone is missing or stolen.	lost_or_stolen_phone		left_only
I'm having trouble verifying my ID.	unable_to_verify_identity		left_only
I was supposed to get a purchase refunded but I don't see the money in my account	Refund_not_showing_up		left_only
How long does it take for a top up to be approved?	pending_top_up		left_only
I want to activate my card, how do I do it?	activate_my_card		left_only
Can I use check to deposit?	top_up_by_cash_or_cheque		left_only
on my statement there is a payment that I don't recognise	card_payment_not_recognised		left_only
My money disappeared right when I tried to top up	topping_up_by_card		left_only
I cant prove who I am	unable_to_verify_identity		left_only
I cannot try my PIN anymore.	pin_blocked		left_only
The NFC payment wouldn't work on the bus today. Help?	contactless_not_working		left_only
Which one are you?  Visa or Mastercard?	visa_or_mastercard		left_only
I'm not okay with this fee on my statement.	extra_charge_on_statement		left_only
Google Pay won't let me top up.	apple_pay_or_google_pay		left_only
Can I cancel a transfer I made	cancel_transfer		left_only
I'd like to cancel a transfer	cancel_transfer		left_only
I do not see the card PIN anywhere?	get_physical_card		left_only
Is it possible for a friend to personally send me a payment?	receiving_money		left_only
Why are fees charged on cash withdrawals? I went to withdraw some money earlier today after shopping. There's a fee that wasn't there before.	cash_withdrawal_charge		left_only
How do I go about getting a refund?	request_refund		left_only
How can I get my card out of the damn ATM?	card_swallowed		left_only
I think that there is a payment on my card that I did not authorize.  I don't recognize the name attached to the transaction.	card_payment_not_recognised		left_only
I bought an item at the wrong exchange rate.	card_payment_wrong_exchange_rate		left_only
Can I start an account for my kids?	age_limit		left_only
How can I get a virtual card for a one-time transaction?	get_disposable_virtual_card		left_only
Cash withdrawal was incorrect at ATM.	wrong_amount_of_cash_received		left_only
I would like it if I could get an item refunded	request_refund		left_only
I need to move money from another bank to this account.	transfer_into_account		left_only
I really need money from my card today, but my card is getting declined. Please help!!	top_up_failed		left_only
What about a auto top-up?	automatic_top_up		left_only
I made a transaction this morning but I need to revert it now.	cancel_transfer		left_only
My transfer still says pending	pending_transfer		left_only
I'm in China and really need a new card.	card_about_to_expire		left_only
My bag got stolen with all my cards. Can you please cancel my card and send a new one?	lost_or_stolen_card		left_only
What is the procedure for activating this card?	activate_my_card		left_only
This is frustrating, I'm at work and my transfers are not going through. I keep getting an error message, I do not have time for this.	beneficiary_not_allowed		left_only
Why was I declined getting cash?	declined_cash_withdrawal		left_only
I want to top up by cheque	top_up_by_cash_or_cheque		left_only
I received duplicate charges.	transaction_charged_twice		left_only
Why was I declined from getting cash?	declined_cash_withdrawal		left_only
My disposable virtual card will not work	virtual_card_not_working		left_only
How does on apply fora refund on an item he ordered? I ordere an item and have not received it yet so i want to cancel it and get a refund	request_refund		left_only
In which stores can I shop with this card?	card_acceptance		left_only
How can I tell if there will be a fee added to my payment or not?	card_payment_fee_charged		left_only
Hey, I attempted to top up my card today and for some reason it didn't work. When I did it the other way it worked just fine. Could you help me figure out why this is happening please?	top_up_failed		left_only
Will a cheque suffice?	top_up_by_cash_or_cheque		left_only
Why do you need so much information about me	why_verify_identity		left_only
how does a virtual card work	get_disposable_virtual_card		left_only
How long does it take for a purchase to go from pending to authorised?	pending_card_payment		left_only
Do you need my birthdate?	why_verify_identity		left_only
Please explain why the transfers shows up as pending?	pending_transfer		left_only
Does it matter which card I use	visa_or_mastercard		left_only
How long will a transfer take from Europe?	transfer_timing		left_only
Help!  The app has an ATM withdrawl that I didn't make.	cash_withdrawal_not_recognised		left_only
I have obtained the salary in GBP, will it need to be configured?	receiving_money		left_only
I made a purchase recently but I have decided that I'm not buying it and I need to receive my money back. Can you please give me a refund ASAP. It's extremely urgent.	request_refund		left_only
I have a charge I did not make.	card_payment_not_recognised		left_only
I think someone saw my PIN and I am on vacation in Spain, can I change it locally at an ATM?	change_pin		left_only
I've just come back from an eating holiday in the USA and Canada and have SO many pending and duplicated transactions on my account.  I think there is something wrong, can you look in to it please?	transaction_charged_twice		left_only
My top-up was declined	top_up_failed		left_only
Why would a transfer fail?	failed_transfer		left_only
I want to do a cash deposit to top up. How do I do this?	top_up_by_cash_or_cheque		left_only
I had a payment reverted and would like to figure out why.	reverted_card_payment?		left_only
I believe i was charged for making a withdrawal after i went grocery shopping. Are you guys charging for this now?	cash_withdrawal_charge		left_only
Am I able to use my account if the identity verification is not complete?	why_verify_identity		left_only
There has been a payment  in the App that has not be done by me.	card_payment_not_recognised		left_only
Why hasn't my balance increased after depositing a check?	balance_not_updated_after_cheque_or_cash_deposit		left_only
I need to do a card activation.	activate_my_card		left_only
Send me my card now! ASAP	card_delivery_estimate		left_only
A transfer could not be completed.	failed_transfer		left_only
I need a new card.	getting_spare_card		left_only
Double check your funds may be declined	declined_transfer		left_only
Why is there a random withdrawal in my app?	cash_withdrawal_not_recognised		left_only
Please help me unblock my pin which I put the wrong one too many times.	pin_blocked		left_only
I want a refund for my item	request_refund		left_only
Is there something wrong with my card payment? It's been pending a really, really long time.	pending_card_payment		left_only
I made a cash withdrawl and there is a charge.  What is this?	cash_withdrawal_charge		left_only
My cash withdrawal was not entirely complete	wrong_amount_of_cash_received		left_only
How can I activate my card so I can start using it?	activate_my_card		left_only
I was charged an extra fee for a card payment. I was unaware of these fees beforehand.	card_payment_fee_charged		left_only
I don't know my PIN, how can I find that out?	get_physical_card		left_only
There is a payment with my card which i definitely did not do.	card_payment_not_recognised		left_only
I made a transfer recently but it has not changed on my dashboard.	pending_transfer		left_only
My friends want to top up my account	topping_up_by_card		left_only
I have an unauthorized charge.	direct_debit_payment_not_recognised		left_only
Hi, i was checking my old statements and found a discrepancy with a large amount transaction. I am sure it was not done by me. Please let me know if i could raise a dispute as its very late.	direct_debit_payment_not_recognised		left_only
with what can I verify my identity?	verify_my_identity		left_only
i want to get my salary deposited as pesos?	receiving_money		left_only
I think my card is being used by someone else to make purchases that I didn't authorize! I checked my account and see that there have been quite a few purchases over the last two days that I have no idea where they came from. We need to freeze my card now! And I need to find a way to get my money back.	card_payment_not_recognised		left_only
I got a €1 extra fee in my statement	extra_charge_on_statement		left_only
My physical card is not working	card_not_working		left_only
Can you please explain why my beneficiary is not allowed?	beneficiary_not_allowed		left_only
I can't enter my passcode.	passcode_forgotten		left_only
Why have I been charged for pulling cash out of my own account?	cash_withdrawal_charge		left_only
Can you help me find the virtual card?	getting_virtual_card		left_only
I've been waiting for a refund to show up and I don't see it on my statement yet.	Refund_not_showing_up		left_only
I'm not in the UK, is it possible for me to still get a card?	country_support		left_only
I am seeing a weird payment showing up that I know I did not make, how can I get it cancelled?	direct_debit_payment_not_recognised		left_only
What is the charge for exchanging currencies?	exchange_charge		left_only
Please tell me how to change my pin.	change_pin		left_only
Can I use my Apple Watch to to top up?	apple_pay_or_google_pay		left_only
How many digits identify the top-up verification code?	verify_top_up		left_only
There is money missing from my account.	cash_withdrawal_not_recognised		left_only
My transfer did not work, what was the reason?	failed_transfer		left_only
What is identity check?	why_verify_identity		left_only
A couple weeks ago some money was deducted from my account by some seller that I don't remember. I'm pretty sure I didn't do that, but is it possible to trace back who that is just to make sure?	direct_debit_payment_not_recognised		left_only
Hello, I just checked my card transactions and saw that I was charged twice for a restaurant visit I did earlier this week. Is it possible to remove one of them and get my false paid money pack?	transaction_charged_twice		left_only
I think someone stole my card because I can't find it.	lost_or_stolen_card		left_only
Could google pay and top up be together?	apple_pay_or_google_pay		left_only
Where do I find my card PIN?	get_physical_card		left_only
What is the limit to top-up?	top_up_limits		left_only
Someone stole my card. I need to report it stolen. I made a police report already, but how do I report it with you?	lost_or_stolen_card		left_only
Explain why a card payment would be cancelled?	reverted_card_payment?		left_only
Why is the check I deposited this morning not showing up?	balance_not_updated_after_cheque_or_cash_deposit		left_only
There's a payment in the app I don't recognize.	card_payment_not_recognised		left_only
Do you know why my card payment was reverted?	reverted_card_payment?		left_only
Why was I charged multiple times for the same thing?	transaction_charged_twice		left_only
Are there any specific cash machines that I have to go to in order to change my PIN?	change_pin		left_only
Can you make exchanges using the EUR?	fiat_currency_support		left_only
How can I add physical money to my card?	top_up_by_cash_or_cheque		left_only
price of physical card	order_physical_card		left_only
Why isn't my transfer not going through? I keep getting an error message.	beneficiary_not_allowed		left_only
I'm trying to purchase a flat but i need my first payment for my mortgage to go through first. I keep getting an error. I'm not sure what is going on but i need help making this transfer.	failed_transfer		left_only
I cant transfer money into my account	beneficiary_not_allowed		left_only
Can I top up my balance with a cheque?	top_up_by_cash_or_cheque		left_only
There's a refund missing from my statement	Refund_not_showing_up		left_only
can i get a card if I live in the usa?	country_support		left_only
How to cancel a transaction	cancel_transfer		left_only
Is it possible to order another card?	getting_spare_card		left_only
What is the most efficient way to activate my new card?	activate_my_card		left_only
Where is my refund? I have been checking my account all day.	Refund_not_showing_up		left_only
What age do you have to be?	age_limit		left_only
Is there any way to know how the transaction got on my account?	card_payment_not_recognised		left_only
Why would there be an extra charge on my app?	extra_charge_on_statement		left_only
I'm not seeing my cash deposit showing up in my account.	balance_not_updated_after_cheque_or_cash_deposit		left_only
OMG!  I'm trying to load my card and it wont top up!  I desperately need the money either on my card or in my bank, where is it?	pending_top_up		left_only
How does tranferring money into my account work?	transfer_into_account		left_only
i need to expedite my card	card_delivery_estimate		left_only
Why can't I see my top up?	topping_up_by_card		left_only
There was a direct debit I don't recognize.	direct_debit_payment_not_recognised		left_only
My transfer didn't work! Help!	failed_transfer		left_only
Can my salary be received here?	receiving_money		left_only
Can I get paid in another currency?	receiving_money		left_only
Why are you asking so many questions about who I am	why_verify_identity		left_only
I was charged on my account that shouldn't be there.	direct_debit_payment_not_recognised		left_only
I used my card to get cash then I was charged a fee that I shouldn't have been charged.	cash_withdrawal_charge		left_only
Where can I locate my card PIN?	get_physical_card		left_only
I do not recognize the card payment.	card_payment_not_recognised		left_only
I am having trouble withdrawing cash.	declined_cash_withdrawal		left_only
I want to do a cash top-up	top_up_by_cash_or_cheque		left_only
Why hasn't my cash been deposited yet?	balance_not_updated_after_cheque_or_cash_deposit		left_only
Will a beneficiary not accept a transfer?	beneficiary_not_allowed		left_only
Is it possible to get a new card in China?	card_about_to_expire		left_only
What's with not verifying my Id?	unable_to_verify_identity		left_only
What are these disposable virtual cards all about?	get_disposable_virtual_card		left_only
Can you tell me what i steps i should take since my card was stolen?	lost_or_stolen_phone		left_only
Are there charges for cash withdrawals?	cash_withdrawal_charge		left_only
How about disposable virtual cards?	get_disposable_virtual_card		left_only
I made a transfer 12 hours ago. Why is it still listed as pending?	pending_transfer		left_only
Please delete the duplicate payment that was made to my account. One payment is still pending and I do not want to pay twice.	transaction_charged_twice		left_only
I don't recognize this payment on my app, I am sure I didn't spend any money there.	card_payment_not_recognised		left_only
I cannot activate my card.	activate_my_card		left_only
Can cards be delivered? Where?	order_physical_card		left_only
I need help with some transactions in my account that I dont recognize or remember purchasing. Im not sure if the name is just different or what. Should my card be put on hold while the issue gets figured out to be safe or is it ok?	card_payment_not_recognised		left_only
I can't withdraw any money from my account. Ive tried a couple different ATM machines and both of them wouldn't give me my money. What's going on? Is my account frozen or something?	declined_cash_withdrawal		left_only
Why have I been charged an extra pound?	extra_charge_on_statement		left_only
